<?xml version="1.0" encoding="UTF-8"?>
<!DOCTYPE RedAlquiler SYSTEM "Entregable.dtd">

<RedAlquiler>
<Vehiculos cantidadTotal="345">

<Vehiculo idVehiculo="Co1000">
<Tipo>Coche</Tipo>
<Marca>MarcaDeCoche</Marca>
<Modelo>ModeloDeCoche</Modelo>
<FechaMatriculacion ano="2023" mes="Enero" dia="1"/>
<Kilometraje>210000</Kilometraje>
<Matricula>1234ABC</Matricula>
<Potencia unidades="cv">100</Potencia>
<Peso unidades="kg">1450</Peso>
</Vehiculo>

<Vehiculo idVehiculo="Fu2000">
<Tipo>Furgoneta</Tipo>
<Marca>MarcaDeFurgoneta</Marca>
<Modelo>ModeloDeFurgoneta</Modelo>
<FechaMatriculacion ano="2023" mes="Enero" dia="1"/>
<Kilometraje>400000</Kilometraje>
<Matricula>5678DEF</Matricula>
<Potencia unidades="cv">150</Potencia>
<Peso unidades="kg">1750</Peso>
</Vehiculo>

<Vehiculo idVehiculo="Ca3000">
<Tipo>Caravana</Tipo>
<Marca>MarcaDeCaravana</Marca>
<Modelo>ModeloDeCaravana</Modelo>
<FechaMatriculacion ano="2023" mes="Enero" dia="1"/>
<Kilometraje>50000</Kilometraje>
<Matricula>9012GHI</Matricula>
<Potencia unidades="cv">200</Potencia>
<Peso unidades="kg">3500</Peso>
</Vehiculo>

</Vehiculos>

<Clientes cantidadTotal="543">
<Cliente idCliente="CL0001">
<Nombre>nombrecliente1</Nombre>
<Apellidos>Apellido1 Apellido2</Apellidos>
<Tfno>111111111</Tfno>
<Correo>correo@cliente1.com</Correo>
<FechaNacimiento ano="1993" mes="Enero" dia="1"/>
<VehiculoAlquilado idVehiculo="Ca3000"/>
</Cliente>

<Cliente idCliente="CL0002">
<Nombre>nombrecliente2</Nombre>
<Apellidos>Apellido1 Apellido2</Apellidos>
<Tfno>222222222</Tfno>
<Correo>correo@cliente2.com</Correo>
<FechaNacimiento ano="1993" mes="Enero" dia="1"/>
<VehiculoAlquilado idVehiculo="Co1000"/>
</Cliente>

</Clientes>

</RedAlquiler>